<?xml version="1.0" encoding="UTF-8"?>
<list xmlns:xsi="http://www.w3.org/2001/XMLSchema-instance"  xmlns="http://l2j.org" xsi:schemaLocation="http://l2j.org options.xsd">
    <option id="15095" name="o_s_55_2s_1">
        <!-- Passive: Increases the recovery rate when MP is being recovered by recharge. -->
        <skill id="3203"/> <!-- Item Skill: Mystery Skill -->
    </option>
    <option id="15096" name="o_s_55_2s_2">
        <!-- Active: Temporarily increases lung capacity. -->
        <skill id="3143" level="4"/> <!-- Item Skill: Kiss of Eva -->
    </option>
    <option id="15097" name="o_s_55_2s_3">
        <!-- Active: Increases the height from which you can jump without sustaining damage for a fixed time. -->
        <skill id="3144" level="4"/> <!-- Item Skill: Acrobatics -->
    </option>
    <option id="15098" name="o_s_55_2s_4">
        <!-- Active: Increases Resistance to damage from falling. -->
        <skill id="3145" level="4"/> <!-- Item Skill: Iron Body -->
    </option>
    <option id="15099" name="o_s_55_2s_5">
        <!-- Active: Ignites a firecracker. -->
        <skill id="3156"/> <!-- Item Skill: Firework -->
    </option>
</list>
